{
  "schemaVersion": "patternly-content-acceptance-baseline-v1",
  "baselineId": "acc-01:2026-09-10",
  "provenance": {
    "kind": "human_owner",
    "id": "lukaszkurczab",
    "confirmationDate": "2026-09-10",
    "confirmationSource": "owner_confirmation_in_active_conversation"
  },
  "canonicalRepresentation": {
    "canonicalJsonVersion": "canonical-json-v1",
    "trackOrder": "ascending-track-id",
    "sourceManifest": "sha256(canonicalJson(sorted [{path,sha256}]))",
    "itemManifest": "sha256(canonicalJson(sorted [{id,fingerprint}]))"
  },
  "tracks": [
    {
      "trackId": "aws-certified-solutions-architect-associate",
      "sourceCommit": "1e35906ccea0f3abbed6814fd828bdc6467318be",
      "sourceRoot": "manual/source/aws-certified-solutions-architect-associate",
      "sourceFileCount": 137,
      "canonicalItemCount": 2568,
      "sourceManifestSha256": "d837d60bb005facbde1fe6520ecb31307b41fa5ebd62a85afac4cb55d2b15477",
      "itemManifestSha256": "d9211e2091505f7dfcf9c0dbc96e6866919047fb30a9ff4371be5c8eccaf6733"
    },
    {
      "trackId": "backend-system-design-interview",
      "sourceCommit": "1e35906ccea0f3abbed6814fd828bdc6467318be",
      "sourceRoot": "manual/source/backend-system-design-interview",
      "sourceFileCount": 89,
      "canonicalItemCount": 1569,
      "sourceManifestSha256": "8cb0a15bcb1c2994a74b419719aca2a9085106da7999641dad5ad06ee3d930ff",
      "itemManifestSha256": "5f9d81cb3ed9ff0d5bb5a52e1259f57cd28a8255982785f3b365d4ae58b7a305"
    },
    {
      "trackId": "claude-certified-architect-professional-certification",
      "sourceCommit": "846b75fafa1fa0a35590622bebd7b1789c95adf7",
      "sourceRoot": "manual/source/claude-certified-architect-professional-certification",
      "contentVersion": "ccarp-2026.09.03",
      "sourceFileCount": 38,
      "canonicalItemCount": 300,
      "sourceManifestSha256": "d62e69e8dbd24bd91d09016185bb5cfbe1a6e3ab065344ad259802eecfa5c0f1",
      "itemManifestSha256": "95fa7656d3b92dc2113b45ad40bca4f6c327306da31270c68b8d7fba1f335c51"
    },
    {
      "trackId": "coding-interview-dsa-problem-solving",
      "sourceCommit": "1e35906ccea0f3abbed6814fd828bdc6467318be",
      "sourceRoot": "manual/source/coding-interview-dsa-problem-solving",
      "sourceFileCount": 213,
      "canonicalItemCount": 3404,
      "sourceManifestSha256": "fa7e1c4ea91414cb8637e99a5d8eb52aee5f1d738626cca7f7c1cec55e5d747c",
      "itemManifestSha256": "8d32e94b0bee05e9a01c650290ba266befe9564b334fbc005d079860c41e82a0"
    },
    {
      "trackId": "frontend-system-design-interview",
      "sourceCommit": "1e35906ccea0f3abbed6814fd828bdc6467318be",
      "sourceRoot": "manual/source/frontend-system-design-interview",
      "sourceFileCount": 88,
      "canonicalItemCount": 1766,
      "sourceManifestSha256": "912d575d340d1bbe681ab00e5cf4bbd38982cdaf6bbd759567b0fe5f1f84f61d",
      "itemManifestSha256": "99071ce3843c6a12302ca75e6209c294b6bf158f0b6b2f63df403bf8eff32e38"
    },
    {
      "trackId": "google-cloud-associate-cloud-engineer",
      "sourceCommit": "1e35906ccea0f3abbed6814fd828bdc6467318be",
      "sourceRoot": "manual/source/google-cloud-associate-cloud-engineer",
      "sourceFileCount": 152,
      "canonicalItemCount": 2981,
      "sourceManifestSha256": "de3f95b1dc78d3624f7e42a4c91c6b7b1c2148a2f69f34d0fafb9ec701568853",
      "itemManifestSha256": "6c7a8e18a1a94713aef04ff99956a93fa8efe463ff90d0d293c44cb051ee3cf1"
    },
    {
      "trackId": "microsoft-azure-administrator-associate-az-104",
      "sourceCommit": "1e35906ccea0f3abbed6814fd828bdc6467318be",
      "sourceRoot": "manual/source/microsoft-azure-administrator-associate-az-104",
      "sourceFileCount": 75,
      "canonicalItemCount": 1288,
      "sourceManifestSha256": "ca3bdfd2de66b2783ea0f670ccaa4f01af5d6736f9f7a3de23cc4fc06ce2d651",
      "itemManifestSha256": "7f8e7ce7a217b9a964102902efdc05ade0188862d115aa531dd9be51b8f3a05c"
    },
    {
      "trackId": "microsoft-azure-ai-fundamentals-ai-901",
      "sourceCommit": "1e35906ccea0f3abbed6814fd828bdc6467318be",
      "sourceRoot": "manual/source/microsoft-azure-ai-fundamentals-ai-901",
      "sourceFileCount": 5,
      "canonicalItemCount": 752,
      "sourceManifestSha256": "13a410f133ccdcbe9a81772b62b1bd2809829ca6ff59b57ebb42ae602f732a3b",
      "itemManifestSha256": "8e32f1b55b195c4a330dfe06180bbb97e40951155a43c1968284e0d87dfc86c3"
    },
    {
      "trackId": "object-oriented-design-interview",
      "sourceCommit": "1e35906ccea0f3abbed6814fd828bdc6467318be",
      "sourceRoot": "manual/source/object-oriented-design-interview",
      "sourceFileCount": 79,
      "canonicalItemCount": 1413,
      "sourceManifestSha256": "b0aa400ce61dba894a43b3081a355ddeedd82af1a542a7d7a7c79d9d522615e3",
      "itemManifestSha256": "e99f443c2478d079a11bf2559dcde661ae58c39a5f48f5160c836122ba7437fd"
    }
  ]
}
